{
  "$schema": "https://json-schema.org/draft/2020-12/schema",
  "$id": "https://github.com/zcstarr/roasted/schemas/openroast-recipe.schema.json",
  "$ref": "#/$defs/OpenRoastRecipe",
  "$defs": {
    "OpenRoastBean": {
      "properties": {
        "region": {
          "type": "string"
        },
        "source": {
          "$ref": "#/$defs/OpenRoastBeanSource"
        },
        "country": {
          "type": "string"
        }
      },
      "additionalProperties": false,
      "type": "object"
    },
    "OpenRoastBeanSource": {
      "properties": {
        "reseller": {
          "type": "string"
        },
        "link": {
          "type": "string"
        }
      },
      "additionalProperties": false,
      "type": "object"
    },
    "OpenRoastDescription": {
      "properties": {
        "roastType": {
          "type": "string"
        },
        "description": {
          "type": "string"
        }
      },
      "additionalProperties": false,
      "type": "object"
    },
    "OpenRoastRecipe": {
      "properties": {
        "creator": {
          "type": "string"
        },
        "roastName": {
          "type": "string"
        },
        "steps": {
          "items": {
            "$ref": "#/$defs/OpenRoastRecipeStep"
          },
          "type": "array",
          "minItems": 1
        },
        "bean": {
          "$ref": "#/$defs/OpenRoastBean"
        },
        "totalTime": {
          "type": "integer",
          "minimum": 0
        },
        "roastDescription": {
          "$ref": "#/$defs/OpenRoastDescription"
        }
      },
      "additionalProperties": false,
      "type": "object",
      "required": [
        "steps"
      ]
    },
    "OpenRoastRecipeStep": {
      "properties": {
        "targetTemp": {
          "type": "integer",
          "maximum": 550,
          "minimum": 150
        },
        "fanSpeed": {
          "type": "integer",
          "enum": [
            1,
            2,
            3,
            4,
            5,
            6,
            7,
            8,
            9
          ],
          "maximum": 9,
          "minimum": 1
        },
        "sectionTime": {
          "type": "integer",
          "minimum": 1
        },
        "cooling": {
          "type": "boolean"
        }
      },
      "additionalProperties": false,
      "type": "object",
      "required": [
        "fanSpeed",
        "sectionTime"
      ]
    }
  },
  "$comment": "Code generated by tools/schemagen. DO NOT EDIT."
}
