{
  "creator": "Daniel",
  "roastName": "Diedrich Style (truncated)",
  "steps": [
    {
      "targetTemp": 250,
      "fanSpeed": 9,
      "sectionTime": 30
    },
    {
      "targetTemp": 200,
      "fanSpeed": 9,
      "sectionTime": 60
    },
    {
      "targetTemp": 220,
      "fanSpeed": 9,
      "sectionTime": 60
    },
    {
      "cooling": true,
      "fanSpeed": 9,
      "sectionTime": 180
    }
  ],
  "totalTime": 330,
  "roastDescription": {
    "roastType": "Test fixture",
    "description": "Truncated from Openroast diedrich-style.json for unit tests."
  }
}
